{
  "schema_version": "1.0.0",
  "fee_schedule_id": "fee_fixture_001",
  "verification_status": "unverified",
  "source_url": "https://example.invalid/pending-polymarket-fees",
  "source_title": "FICTIF — aucune donnée Polymarket vérifiée",
  "source_retrieved_at": "2026-10-01T00:00:00.000000Z",
  "effective_from": "2026-01-01T00:00:00.000000Z",
  "effective_to": null,
  "scope_type": "global",
  "scope_value": "*",
  "scope_evidence_ref": null,
  "accounting_unit": "pUSD",
  "maker_rate_micros": 0,
  "taker_rate_micros": 10000,
  "fee_formula": "linear_min_price_1mp",
  "custom_formula_ref": null,
  "fee_charge_unit": "collateral",
  "rounding_rule": "half_up_micros",
  "rounding_increment_micros": 1,
  "notes": "VALEURS FICTIVES. Ne pas utiliser pour un calcul réel. Le barème Polymarket doit être vérifié dans la documentation officielle, daté et versionné.",
  "supersedes_fee_schedule_id": null,
  "created_at": "2026-10-01T00:00:00.000000Z"
}
